{
  "$ref": "#/definitions/ExecutionProfile",
  "definitions": {
    "ExecutionProfile": {
      "type": "object",
      "properties": {
        "schema": {
          "type": "string",
          "const": "workforce.execution-profile/v1"
        },
        "profileId": {
          "type": "string",
          "enum": [
            "workspace-autonomy",
            "bounded-operations",
            "high-assurance"
          ]
        },
        "profileVersion": {
          "type": "integer",
          "exclusiveMinimum": 0
        },
        "executionExperience": {
          "type": "string",
          "minLength": 1
        },
        "acceptanceBehavior": {
          "type": "string",
          "minLength": 1
        }
      },
      "required": [
        "schema",
        "profileId",
        "profileVersion",
        "executionExperience",
        "acceptanceBehavior"
      ],
      "additionalProperties": false
    }
  },
  "$schema": "http://json-schema.org/draft-07/schema#"
}
